listingUrl,displayAddress,price,propertySubType,propertyImage,detailedDescription,sizeFt,sizeAc,postalCode,brochureUrl,agentCompanyName,agentName,agentCity,agentEmail,agentPhone,agentStreet,agentPostcode,tenure,saleType
https://www.goldenberg.co.uk/wp-content/uploads/2025/09/GRE-Grays-Inn-Road-FINAL-020925.pdf,247 – 249 Grays Inn Road London WC1,2000000,,['https://www.goldenberg.co.uk/wp-content/uploads/2025/04/Grays-Inn-Rd-Mailer-image-600x400.jpg'],"Prime corner position at the junction of Gray’s Inn Road and Argyle Street 
Just 3 minutes’ walk from King’s Cross Station 
Freehold interest 
Total floor area: 4,551 sq ft 
Currently designated as E Class 
Suitable for developers or owner-occupiers 
Significant value-add potential through refurbishment and extension 
Permitted conversion of upper floors to residential under Class G 
Potential full conversion to residential, subject to consents 
Guide Price: Offers in excess of £2,000,000, reflecting a capital value of just £439 per sq ft",4551,,WC1,https://www.goldenberg.co.uk/wp-content/uploads/2025/09/GRE-Grays-Inn-Road-FINAL-020925.pdf,Goldenberg Real Estate,,,,,,,Freehold,
https://www.goldenberg.co.uk/wp-content/uploads/2025/05/GRE-Bateman-St-FINAL.pdf,22 Bateman Street Soho London W1,300000,,['https://www.goldenberg.co.uk/wp-content/uploads/2025/05/Bateman-St.-W1-1-600x400.jpg'],"Rare prime Soho location, in the heart of London’s most vibrant district 
Fully let, 4 storey mixed use building 
Freehold 
Positioned moments from Soho Square, Oxford Street, and Tottenham Court Road 
Excellent transport connectivity with access to the Elizabeth Line at Tottenham Court Road 
Surrounded by an eclectic mix of retail, hospitality, and cultural amenities 
£3,00,000, reflecting a net initial yield of 4.5% and a capital value of £1,101 per sq ft",,,W1,https://www.goldenberg.co.uk/wp-content/uploads/2025/05/GRE-Bateman-St-FINAL.pdf,Goldenberg Real Estate,,,,,,,Freehold,
https://www.goldenberg.co.uk/wp-content/uploads/2024/05/GRE-Ascentis-House-Lancaster.pdf,"Well let HQ Office Investment, Lancaster",3500000,,['https://www.goldenberg.co.uk/wp-content/uploads/2024/05/Ascentis-House-11-web-600x400.jpg'],"Grade A new build, HQ office investment 
Let to Ascentis, a highly regarded educational charity 
Let with 12 years unexpired 
EPC A 
Attractive lot size of £3,500,000 
NIY 7%",,,,https://www.goldenberg.co.uk/wp-content/uploads/2024/05/GRE-Ascentis-House-Lancaster.pdf,Goldenberg Real Estate,,,,,,,,
https://www.goldenberg.co.uk/wp-content/uploads/2022/12/GRE-Dover-St-Market-FINAL.pdf,Super Prime Retail Investment For Sale  – Haymarket London SW1,65000000,,['https://www.goldenberg.co.uk/wp-content/uploads/2016/05/slide-4-1-600x400.jpg'],"Stunning super prime freehold St James’s building steeped in British fashion history having been built by Burberry as their headquarters for almost 100 years Gross internal area is 31,384 sq ft (NIA 25,800 sq ft) 
Arranged over basement, ground and 3 upper floors. 
Let entirely to globally known premium fashion retailer Dover Street Market International (DMSI) Ltd with surety from Comme Des Garçons International SAS 
Passing rent of £2,570,612 p.a. 
Let until 2034, subject to a tenant break clause in 2029. 
Landlord friendly rent reviews, based on the higher of A1/A2/A3 for the ground, basement and 1st floors and high quality offices with separate entrance for the 2nd and 3rd floors, thus allowing scope for a significant increase at review. 
Offers in excess of £65,000,000 which would represent an net initial yield of c.3.9% and 
a reversionary yield, post 2024 rent review, of 6% (assuming 1.8% costs for an SPV purchase). This represents a capital value per square foot of £2,031 based upon the Gross Internal Area.",31384,,SW1,https://www.goldenberg.co.uk/wp-content/uploads/2022/12/GRE-Dover-St-Market-FINAL.pdf,Goldenberg Real Estate,,,,,,,Freehold,
