listingUrl,displayAddress,price,propertySubType,propertyImage,detailedDescription,sizeFt,sizeAc,postalCode,brochureUrl,agentCompanyName,agentName,agentCity,agentEmail,agentPhone,agentStreet,agentPostcode,tenure,saleType,date,status
https://hummerstonehawkins.com/property/broadway-bexleyheath-da6-7ez/,"Broadway, Bexleyheath, DA6 7EZ",,Office,"['https://hummerstonehawkins.com/wp-content/uploads/2026/02/P1030145-scaled.jpg', 'https://hummerstonehawkins.com/wp-content/uploads/2026/02/P1030143-scaled.jpg', 'https://hummerstonehawkins.com/wp-content/uploads/2026/02/P1030144-scaled.jpg']",Two 1st floor offices available to let. Office 1 suitable for 2 persons. Office 2 suitable for 3 persons. To be let individually or combined. Bills to be included in the rent. Available on a 12 month licence. Property Summary *TWO WELL PRESENTED 1st FLOOR OFFICES TO LET* Office 1 appears suitable for 2 persons and office 2 for 3 persons. Monthly rents including bills are £425pcm and £475pcm. + − | © OpenStreetMap contributors,106,,DA6 7EZ,['https://hummerstonehawkins.com/wp-content/uploads/2026/02/1st-Floor-137-Broadway-Bexleyheath-DA6-7EZ.pdf'],Hummerstone & Hawkins,,,,,,,,To Let,2026-02-18,New
https://hummerstonehawkins.com/property/upper-wickham-lane-welling-da16-3aa/,"Upper Wickham Lane, Welling, DA16 3AA",,Retail Property (High Street),"['https://hummerstonehawkins.com/wp-content/uploads/2026/02/13-Upper-Wickham-Lane.jpg-1.jpg', 'https://hummerstonehawkins.com/wp-content/uploads/2026/02/13-Upper-Wickham-Lane.jpg-2.jpg', 'https://hummerstonehawkins.com/wp-content/uploads/2026/02/13-Upper-Wickham-Lane.jpg']","Ground floor E class premises to let Total floor area of c. 585sq ft. High volumes of passing trade. Ideal for variety E class uses. Situated close to Welling corner. Available on a new lease, terms negotiable. Property Summary *E CLASS PREMISES AVAILABLE TO LET* Floor area of C. 585sq ft, busy location, available on new lease terms + − | © OpenStreetMap contributors",585,,DA16 3AA,['https://hummerstonehawkins.com/wp-content/uploads/2026/02/13-Upper-Wickham-Lane-Welling-DA16-3AA.pdf'],Hummerstone & Hawkins,,,,,,,,To Let,2026-02-18,New
https://hummerstonehawkins.com/property/bellegrove-road-welling-da16-3pa-2/,"Bellegrove Road, Welling, DA16 3PA",,Retail Property (High Street),['https://hummerstonehawkins.com/wp-content/uploads/2026/02/19-Bellegrove-Road-scaled.jpg'],"E Class premises to let Main sales area of c. 62sq m / 667sq ft. Includes rear tea making area + WC High volumes of passing trade. Situated close to Welling corner Agreeable on new lease terms. Property Summary *TO LET - E CLASS PREMISES LOCATED AT WELLING CORNER* Floor area of c. 700sq ft. Strong trading position near Welling corner, + − | © OpenStreetMap contributors",700,,DA16 3PA,['https://hummerstonehawkins.com/wp-content/uploads/2026/02/19-Bellegrove-Road-Welling-DA16-3PA-1.pdf'],Hummerstone & Hawkins,,,,,,,,To Let,2026-02-18,New
https://hummerstonehawkins.com/property/conduit-mews-conduit-road-plumstead-se18-7ap/,"Conduit Mews, Conduit Road, Plumstead, SE18 7AP",295000,"Investment, Office","['https://hummerstonehawkins.com/wp-content/uploads/2026/01/1.jpg', 'https://hummerstonehawkins.com/wp-content/uploads/2026/01/3.jpg', 'https://hummerstonehawkins.com/wp-content/uploads/2026/01/2.jpg']","Office and workshop in Plumstead available for sale. Total floor area of approximately 1,275sq ft. Minimum of 4 parking spaces directly in front of the property. Potential for first floor to be converted to residential (STPP). Well presented internally with very limited works required. Property offered with full vacant posession. Property Summary *New freehold in Plumstead available for sale* With a total floor area of 1,275 this unit would suit a variety of purchasers. + − | © OpenStreetMap contributors",1275,,SE18 7AP,['https://hummerstonehawkins.com/wp-content/uploads/2026/01/Conduit-Mews-Plumstead-SE18-7AP.pdf'],Hummerstone & Hawkins,,,,,,,Freehold,For Sale,2026-02-18,New
https://hummerstonehawkins.com/property/lingfield-crescent-falconwood-se9-2rl/,"Lingfield Crescent, Falconwood, SE9 2RL",,Workshop,"['https://hummerstonehawkins.com/wp-content/uploads/2026/01/3-Lingfield-Crescent.jpg-1-scaled.jpg', 'https://hummerstonehawkins.com/wp-content/uploads/2026/01/3-Lingfield-Crescent-scaled.jpg', 'https://hummerstonehawkins.com/wp-content/uploads/2026/01/3-Lingfield-Crescent.jpg-2-scaled.jpg']",Timber construction workshop Floor area c. 330sq ft Includes a dedicated toilet Rear access for loading / unloading Convenient location Available of flexible terms. Property Summary A workshop of timber construction with a floor area which includes a dedicated toilet plus electric supply. Well suited for storage or workshop use. Flexible lease terms. + − | © OpenStreetMap contributors,330,,SE9 2RL,['https://hummerstonehawkins.com/wp-content/uploads/2026/01/3-Lingfield-Crescent-Eltham-SE9-2RL.pdf'],Hummerstone & Hawkins,,,,,,,,To Let,2026-02-18,New
https://hummerstonehawkins.com/property/heron-hill-belvedere-da17-5er-2/,"Heron Hill, Belvedere, DA17 5ER",625000,Commercial Development,"['https://hummerstonehawkins.com/wp-content/uploads/2026/01/23-Heron-Hill-scaled.jpg', 'https://hummerstonehawkins.com/wp-content/uploads/2026/01/23-Heron-Hill.jpg-1-scaled.jpg', 'https://hummerstonehawkins.com/wp-content/uploads/2026/01/23-Heron-Hill.jpg-2-scaled.jpg', 'https://hummerstonehawkins.com/wp-content/uploads/2026/01/23-Heron-Hill.jpg-3-scaled.jpg']","Workshop, potential for development stpp Property arranged over two floors Ground floor of C. 285sq m / 3,066sq ft First floor of C 205sq m / 2,204sq ft. Popular location / Good transport links Ample kerbside parking. Property Summary *COMMERCIAL DEVELOPMENT OPPORTUNITY (stpp)* The property of C. 490sq m / 5,270sq ft offers potential for redevelopment or conversion, subject to the usual planning consents. + − | © OpenStreetMap contributors",5270,,DA17 5ER,['https://hummerstonehawkins.com/wp-content/uploads/2026/01/Heron-Works-23-Heron-Hill-Belevedere-DA17-5ER.pdf'],Hummerstone & Hawkins,,,,,,,,For Sale,2026-02-18,New
https://hummerstonehawkins.com/property/sidcup-hill-sidcup-da14-6hj-3/,"Sidcup Hill, Sidcup, DA14 6HJ",,Takeaways,['https://hummerstonehawkins.com/wp-content/uploads/2025/12/11.jpg'],"Takeaway premises to let Ground floor area of C. 490 sq.ft Ideal for a variety of cuisines Fronting on to Sidcup Hill Good catchment area Available on flexible lease terms Property Summary *Takeaway premises available to let* Main road position, main public area c. 190sq ft, kitchen 135sq ft, freezer room n/store c. 170sq ft. + − | © OpenStreetMap contributors",490,,DA14 6HJ,['https://hummerstonehawkins.com/wp-content/uploads/2025/12/37-Sidcup-Hill-Sidcup-DA14-6HJ.pdf'],Hummerstone & Hawkins,,,,,,,,To Let,2026-02-18,New
https://hummerstonehawkins.com/property/broadway-bexleyheath-da6-7bd/,"Broadway, Bexleyheath, DA6 7BD",,Office,"['https://hummerstonehawkins.com/wp-content/uploads/2025/12/206-Broadway-scaled.jpg', 'https://hummerstonehawkins.com/wp-content/uploads/2025/12/206-Broadway.jpg-1-scaled.jpg', 'https://hummerstonehawkins.com/wp-content/uploads/2025/12/206-Broadway.jpg-3-scaled.jpg', 'https://hummerstonehawkins.com/wp-content/uploads/2025/12/206-Broadway.jpg-2-scaled.jpg']","1st & 2nd floor rooms to let 4Rooms ranging from 85sq ft to 185sq ft Ideally suit as a 4 room office suite. Located in heart of town centre High volume of passing trade Available of flexible terms. Property Summary *1st & 2nd Floor rooms to let* Room 1 - 140sq ft, Room 2 - 85sq ft, Room 3 - 185sq ft, Room 4 125sq ft. Ideally suit as an office suite. + − | © OpenStreetMap contributors",535,,DA6 7BD,['https://hummerstonehawkins.com/wp-content/uploads/2025/12/1st-Floor-206-Broadway-Bexleyheath-DA6-7BD.pdf'],Hummerstone & Hawkins,,,,,,,,To Let,2026-02-18,New
https://hummerstonehawkins.com/property/london-road-stone-greenhithe-da9-9jw/,"London Road, Stone, Greenhithe, DA9 9JW",850000,Office,"['https://hummerstonehawkins.com/wp-content/uploads/2025/12/152-London-Road-scaled.jpg', 'https://hummerstonehawkins.com/wp-content/uploads/2025/12/152-London-Road.jpg-3-scaled.jpg', 'https://hummerstonehawkins.com/wp-content/uploads/2025/12/152-London-Road.jpg-2-scaled.jpg']","Fairly sizeable 2 storey office building. Office floor area: C. 492sq m / 5,302sq ft. Includes a 2-3 bed flat of C. 883sq ft. 7 dedicated parking spaces. Good & easy transport links. Development potential (stpp). Property Summary *FOR SALE - FREEHOLD 2 STOREY OFFICE BUILDING* Ground floor C. 3,418 sq ft. / 1st floor C. 1,884 sq ft plus includes at 1st floor level a 2-3 bedroom flat of C. 883sq ft. Property includes 7 dedicated parking spaces. + − | © OpenStreetMap contributors",6165,,DA9 9JW,['https://hummerstonehawkins.com/wp-content/uploads/2025/12/152-154-London-Road-Greenhithe-Kent-DA9-9JW.pdf'],Hummerstone & Hawkins,,,,,,,Freehold,For Sale,2026-02-18,New
https://hummerstonehawkins.com/property/kashgar-road-plumstead-se18-1dy/,"Kashgar Road, Plumstead, SE18 1DY",,Office,"['https://hummerstonehawkins.com/wp-content/uploads/2025/11/7-Dennington-Mews.jpg-2.jpg', 'https://hummerstonehawkins.com/wp-content/uploads/2025/11/7-Dennington-Mews.jpg-3.jpg', 'https://hummerstonehawkins.com/wp-content/uploads/2025/11/7-Dennington-Mews.jpg-5.jpg', 'https://hummerstonehawkins.com/wp-content/uploads/2025/11/7-Dennington-Mews.jpg', 'https://hummerstonehawkins.com/wp-content/uploads/2025/11/7-Dennington-Mews.jpg-1.jpg', 'https://hummerstonehawkins.com/wp-content/uploads/2025/11/7-Dennington-Mews.jpg-4.jpg']",Newly built office / class E unit to let Floor area of C. 82sq m / 882sq ft. Premises includes 1 parking space. Open plan floor space includes W/C. Pleasant courtyard setting. Good transport links into London. Property Summary *SELF CONTAINED COURTYARD OFFICE TO LET* Newly built office / class E use unit of C. 8832sq ft. Includes one parking space. + − | © OpenStreetMap contributors,882,,SE18 1DY,['https://hummerstonehawkins.com/wp-content/uploads/2026/01/7-Dennington-Mews-Kashgar-Road-Plumstead-SE18-1DY-.pdf'],Hummerstone & Hawkins,,,,,,,,To Let,2026-02-18,New
https://hummerstonehawkins.com/property/erith-road-bexleyheath-da7-6bu/,"Erith Road, Bexleyheath, DA7 6BU",,Takeaways,"['https://hummerstonehawkins.com/wp-content/uploads/2025/11/132-Erith-Road-Bexleyheath-DA7-6BU.jpg-4-scaled.jpg', 'https://hummerstonehawkins.com/wp-content/uploads/2025/11/132-Erith-Road-Bexleyheath-DA7-6BU.jpg-1-scaled.jpg', 'https://hummerstonehawkins.com/wp-content/uploads/2025/11/132-Erith-Road-Bexleyheath-DA7-6BU.jpg-6-scaled.jpg', 'https://hummerstonehawkins.com/wp-content/uploads/2025/11/132-Erith-Road-Bexleyheath-DA7-6BU.jpg-5-scaled.jpg', 'https://hummerstonehawkins.com/wp-content/uploads/2025/11/132-Erith-Road-Bexleyheath-DA7-6BU.jpg-7-scaled.jpg', 'https://hummerstonehawkins.com/wp-content/uploads/2025/11/132-Erith-Road-Bexleyheath-DA7-6BU.jpg-3-scaled.jpg', 'https://hummerstonehawkins.com/wp-content/uploads/2025/11/132-Erith-Road-Bexleyheath-DA7-6BU.jpg-2-scaled.jpg', 'https://hummerstonehawkins.com/wp-content/uploads/2025/11/132-Erith-Road-Bexleyheath-DA7-6BU-scaled.jpg', 'https://hummerstonehawkins.com/wp-content/uploads/2025/11/132-Erith-Road-Bexleyheath-DA7-6BU.jpg-8-scaled.jpg']","Chinese takeaway business for sale Includes owners living accommodation Advised weekly sales of C. £4,000. Fronting on to a busy main road Premium of £75,000 Property Summary *CHINESE TAKEAWAY BUSINESS FOR SALE* Owners accommodation included, Advised weekly sales of C. £4,000. Premises held on lease until 2042. Premium for business of £75,000. + − | © OpenStreetMap contributors",1115,,DA7 6BU,['https://hummerstonehawkins.com/wp-content/uploads/2025/11/Fortune-Star-132-Erith-Road-Bexleyheath-DA7-6BU.pdf'],Hummerstone & Hawkins,,,,,,,,To Let,2026-02-18,New
https://hummerstonehawkins.com/property/broadway-bexleyheath-da6-7dq/,"Broadway, Bexleyheath, DA6 7DQ",12500,Office,"['https://hummerstonehawkins.com/wp-content/uploads/2025/11/124-Broadway.jpg-2-scaled.jpg', 'https://hummerstonehawkins.com/wp-content/uploads/2025/11/124-Broadway.jpg-6-scaled.jpg', 'https://hummerstonehawkins.com/wp-content/uploads/2025/11/124-Broadway.jpg-1-scaled.jpg', 'https://hummerstonehawkins.com/wp-content/uploads/2025/11/124-Broadway.jpg-5-scaled.jpg']","Well presented 1st floor office to let Comprising a reception plus 3 offices Floor area of C. 38sq m / 410sq ft. Entrance fronting on to the Broadway May suit for therapy / medical business Available on flexible lease terms Property Summary *FIRST FLOOR OFFICE TO LET* Floor area of C. 410sq ft, configured to provide a reception area plus 3 offices. Prime location on the pedestrian section of the Broadway. + − | © OpenStreetMap contributors",410,,DA6 7DQ,['https://hummerstonehawkins.com/wp-content/uploads/2025/11/1st-Floor-124-Broadway-Bexleyheath-DA6-7DQ.pdf'],Hummerstone & Hawkins,,,,,,,,For Sale,2026-02-18,New
https://hummerstonehawkins.com/property/wickham-lane-abbey-wood-se2-0xj/,"Wickham Lane, Abbey Wood, SE2 0XJ",475000,"Investment, Retail Property (High Street)","['https://hummerstonehawkins.com/wp-content/uploads/2025/11/1-Wickham-Lane-scaled.jpg', 'https://hummerstonehawkins.com/wp-content/uploads/2025/11/1-Wickham-Lane.jpg-11-scaled.jpg', 'https://hummerstonehawkins.com/wp-content/uploads/2025/11/1-Wickham-Lane.jpg-13-scaled.jpg', 'https://hummerstonehawkins.com/wp-content/uploads/2025/11/1-Wickham-Lane.jpg-9-scaled.jpg', 'https://hummerstonehawkins.com/wp-content/uploads/2025/11/1-Wickham-Lane.jpg-5-scaled.jpg', 'https://hummerstonehawkins.com/wp-content/uploads/2025/11/1-Wickham-Lane.jpg-3-scaled.jpg', 'https://hummerstonehawkins.com/wp-content/uploads/2025/11/1-Wickham-Lane.jpg-6-scaled.jpg', 'https://hummerstonehawkins.com/wp-content/uploads/2025/11/1-Wickham-Lane.jpg-1-scaled.jpg']","Freehold mixed use investment. Total rental income of £32,300pa. G/F hairdressers held on lease until 2035 3 Bedroom flat over upper floors. Lease includes reviews 2026, 29 & 32. Prominent corner position on a busy road Property Summary *MIXED USE INVESTMENT OPPORTUNITY FOR SALE* Total rental income of £32,300pa. Ground floor income £15,500pa, 3 bedroom flat producing a rental of £16,800pa.",1600,,SE2 0XJ,['https://hummerstonehawkins.com/wp-content/uploads/2025/11/1-Wickham-Lane-Abbey-Wood-SE2-0XJ-346-Plumstead-High-Street-Plumstaed-SE18-1JU-3.pdf'],Hummerstone & Hawkins,,,,,,,Freehold,For Sale,2026-02-18,New
https://hummerstonehawkins.com/property/blue-mermaid-fish-bar-victoria-road-ct14-7bn/,"Blue Mermaid Fish Bar, Victoria Road, CT14 7BN",,Takeaways,"['https://hummerstonehawkins.com/wp-content/uploads/2025/10/3-1.jpg', 'https://hummerstonehawkins.com/wp-content/uploads/2025/10/2-1-scaled.jpg', 'https://hummerstonehawkins.com/wp-content/uploads/2025/10/4.jpg', 'https://hummerstonehawkins.com/wp-content/uploads/2025/10/1-1.jpg']","Advised weekly sales of C. £7,500 (C. GP 50% 55%). Includes a 3 bedroom flat. 10 covers + some outside seating. High levels of passing trade Bay parking in front of the property. Modest rental of £17,900pa. Property Summary *Busy Fish and Chip shop for sale* Includes a self contained 3 bedroom flat. Advised average weekly sales of C. £7,500 (GP 50% - 55%) Viewing is highly recommended. + − | © OpenStreetMap contributors",,,CT14 7BN,['https://hummerstonehawkins.com/wp-content/uploads/2026/02/Blue-Mermaid-Fishbar-18-Victoria-Road-Deal-CT14-7BN.pdf'],Hummerstone & Hawkins,,,,,,,,To Let,2026-02-18,New
https://hummerstonehawkins.com/property/brook-street-northumberland-heath-erith-da8-1jj/,"Brook Street, Northumberland Heath, Erith, DA8 1JJ",,Retail Property (High Street),"['https://hummerstonehawkins.com/wp-content/uploads/2025/10/87-Brook-Street-Erith.jpg-1-scaled.jpg', 'https://hummerstonehawkins.com/wp-content/uploads/2025/10/87-Brook-Street-Erith.jpg-2-scaled.jpg']","E Class premises to let Floor area C. 28sq m / 300sq ft Corner position at Brook St & Belomont Rd Premises secured by an electric shutter Ideal office / nail bar / barber. Available on flexible lease terms Property Summary *AVAILABLE TO LET* A corner retail premises of C. 300sq ft suitable for an office, barbers or nail bar. + − | © OpenStreetMap contributors",300,,DA8 1JJ,['https://hummerstonehawkins.com/wp-content/uploads/2025/10/87-Brook-Street-Northumberland-Heath-Erith-DA8-1JJ.pdf'],Hummerstone & Hawkins,,,,,,,,To Let,2026-02-18,New
https://hummerstonehawkins.com/property/blackfen-road-blackfen-sidcup-da15-8pr/,"Blackfen Road, Blackfen, Sidcup, DA15 8PR",,Retail Property (High Street),['https://hummerstonehawkins.com/wp-content/uploads/2025/10/Picture1.jpg'],"Commercial unit on Blackfen Road available to let. Total floor area of approximately 625sq ft. Parking forecourt for up to 3 cars directly in front of property. Located in one of the most sought after locations. Fronting onto busy main road, high levels of passing trade. Available on a new lease, terms negotiable. Property Summary *New Commercial 'E' class premises in Blackfen available to let*",625,,DA15 8PR,['https://hummerstonehawkins.com/wp-content/uploads/2025/10/239-Blackfen-Rd-Sidcup-DA15-8PR.pdf'],Hummerstone & Hawkins,,,,,,,,To Let,2026-02-18,New
https://hummerstonehawkins.com/property/park-view-road-welling-da16-1st/,"Park View Road, Welling, DA16 1ST",14000,Retail Property (High Street),"['https://hummerstonehawkins.com/wp-content/uploads/2025/10/180-Park-View-Road.jpg-7-scaled.jpg', 'https://hummerstonehawkins.com/wp-content/uploads/2025/10/180-Park-View-Road-scaled.jpg', 'https://hummerstonehawkins.com/wp-content/uploads/2025/10/180-Park-View-Road.jpg-3-scaled.jpg', 'https://hummerstonehawkins.com/wp-content/uploads/2025/10/180-Park-View-Road.jpg-4-scaled.jpg', 'https://hummerstonehawkins.com/wp-content/uploads/2025/10/180-Park-View-Road.jpg-6-scaled.jpg', 'https://hummerstonehawkins.com/wp-content/uploads/2025/10/180-Park-View-Road.jpg-1-scaled.jpg', 'https://hummerstonehawkins.com/wp-content/uploads/2025/10/180-Park-View-Road.jpg-2-scaled.jpg', 'https://hummerstonehawkins.com/wp-content/uploads/2025/10/180-Park-View-Road.jpg-5-scaled.jpg']",Ground floor retail / office premises Total floor area of C. 750sq ft Rear parking area for 3 vehicles High volume of passing traffic Well situated with good transport links Avaialble on new lease terms. Property Summary *750sq ft of retail / office space available to let* Includes a hardstanding parking area for 3 vehicles. Located on a busy main road in Welling this E class premises is being offered on new lease terms. + − | © OpenStreetMap contributors,750,,DA16 1ST,['https://hummerstonehawkins.com/wp-content/uploads/2025/10/180-Park-View-Road-Welling-DA16-1ST.pdf'],Hummerstone & Hawkins,,,,,,,,For Sale,2026-02-18,New
https://hummerstonehawkins.com/property/edendale-road-bexleyheath-da7-6rl/,"Edendale Road, Bexleyheath, DA7 6RL",825000,"Commercial Development, Residential Development","['https://hummerstonehawkins.com/wp-content/uploads/2025/10/95-Edenhill-Road.jpg-1-scaled.jpg', 'https://hummerstonehawkins.com/wp-content/uploads/2025/10/95-Edenhill-Road.jpg-6-scaled.jpg', 'https://hummerstonehawkins.com/wp-content/uploads/2025/10/95-Edenhill-Road.jpg-3-scaled.jpg', 'https://hummerstonehawkins.com/wp-content/uploads/2025/10/95-Edenhill-Road.jpg-8-scaled.jpg', 'https://hummerstonehawkins.com/wp-content/uploads/2025/10/95-Edenhill-Road-scaled.jpg', 'https://hummerstonehawkins.com/wp-content/uploads/2025/10/95-Edenhill-Road.jpg-7-scaled.jpg', 'https://hummerstonehawkins.com/wp-content/uploads/2025/10/95-Edenhill-Road.jpg-2-scaled.jpg', 'https://hummerstonehawkins.com/wp-content/uploads/2025/10/95-Edenhill-Road.jpg-4-scaled.jpg']","An extended 3 bed semi det bungalow Planning permission 24/02207/FUL To add additional 2 x 2 bed bungalows Located in a quiet & desirable area. Well situated for good transport links Each new bungalow will be C. 64sq m Property Summary *RESIDENTIAL DEVELOPMENT OPPORTUNITY* An extended 3 bedroom semi det bungalow which is situated on a sizeable plot which is being sold with the benefit of planning to construct 2 additional semi detached bungalows, Ref 24/02207/FUL.",1085,,DA7 6RL,['https://hummerstonehawkins.com/wp-content/uploads/2025/10/95-Edendale-Road-Bexleyheath-DA7-6RL-.pdf'],Hummerstone & Hawkins,,,,,,,,For Sale,2026-02-18,New
https://hummerstonehawkins.com/property/princes-street-bexleyheath-da7-4bj/,"Princes Street, Bexleyheath, DA7 4BT",18500,"Storage, Workshop","['https://hummerstonehawkins.com/wp-content/uploads/2025/10/2-Princes-Street.jpg-2-scaled.jpg', 'https://hummerstonehawkins.com/wp-content/uploads/2025/10/2-Princes-Street-scaled.jpg', 'https://hummerstonehawkins.com/wp-content/uploads/2025/10/2-Princes-Street.jpg-1-scaled.jpg']","Workshop / Storage premises to let. Total floor area of 156sq m / 1,679sq ft Includes a hardstanding parking area. Close to Bexleyheath town centre. May be suitable for a variety of uses. Avaialble on a new 3 year lease. Property Summary *WORKSHOP / STORAGE PREMISES TO LET* C. 1,679sq ft plus includes a secure hardstanding parking area. Close to Bexleyheath town centre. + − | © OpenStreetMap contributors",1679,,DA7 4BT,['https://hummerstonehawkins.com/wp-content/uploads/2025/10/2-Princes-Street-Bexleyheath-DA6-8BB-.pdf'],Hummerstone & Hawkins,,,,,,,,For Sale,2026-02-18,New
https://hummerstonehawkins.com/property/blanks-lane-charlwood-surrey-rh6-0es/,"Blanks Lane, Charlwood, Surrey, RH6 0ES",50000,Land,['https://hummerstonehawkins.com/wp-content/uploads/2025/10/Albinna-Farm.png'],"Greenbelt agricultural land for sale Advised measurements 1,500 sq m, Situated in Surrey countryside Surrounded by open fields & woodland Well positioned for transport links Alternative uses would be stpp. Property Summary *GREENBELT AGRICULTURAL LAND FOR SALE* We are informed, and not confirmed by us, the size of the plot is C. 1,500sq m / 16,145sq ft. + − | © OpenStreetMap contributors",,,RH6 0ES,['https://hummerstonehawkins.com/wp-content/uploads/2025/10/Albinna-Farm-Blanks-Lane-Charlwood-Surrey-RH6-0ES.-.pdf'],Hummerstone & Hawkins,,,,,,,,For Sale,2026-02-18,New
https://hummerstonehawkins.com/property/high-street-eltham-se9-1ts/,"High Street, Eltham, SE9 1TS",,Restaurant,"['https://hummerstonehawkins.com/wp-content/uploads/2025/09/183-Eltham-High-Street-1-scaled.jpg', 'https://hummerstonehawkins.com/wp-content/uploads/2025/09/183-Eltham-High-Street-1.jpg-4-1-scaled.jpg', 'https://hummerstonehawkins.com/wp-content/uploads/2025/09/183-Eltham-High-Street-1.jpg-2-1-scaled.jpg', 'https://hummerstonehawkins.com/wp-content/uploads/2025/09/183-Eltham-High-Street-1.jpg-5-1-scaled.jpg', 'https://hummerstonehawkins.com/wp-content/uploads/2025/09/183-Eltham-High-Street-1.jpg-9-1-scaled.jpg', 'https://hummerstonehawkins.com/wp-content/uploads/2025/09/183-Eltham-High-Street-1.jpg-8-1-scaled.jpg', 'https://hummerstonehawkins.com/wp-content/uploads/2025/09/183-Eltham-High-Street-1.jpg-10-1-scaled.jpg', 'https://hummerstonehawkins.com/wp-content/uploads/2025/09/183-Eltham-High-Street-1.jpg-6-1-scaled.jpg', 'https://hummerstonehawkins.com/wp-content/uploads/2025/09/183-Eltham-High-Street.jpg-11-scaled.jpg', 'https://hummerstonehawkins.com/wp-content/uploads/2025/09/183-Eltham-High-Street-1.jpg-3-1-scaled.jpg', 'https://hummerstonehawkins.com/wp-content/uploads/2025/09/183-Eltham-High-Street-1.jpg-7-1-scaled.jpg']","Stylish Italian restaurant for sale Spacious layout arranged over 2 floors Advised weekly sales of C. £25,000 Premises refurbished in 2023. Total capacity around 120 covers Premium for business £475,000 Property Summary *LEASEHOLD - STYLISH ITALIAN RESTAURANT FOR SALE* Advised weekly sales C. £25,000. Located in heart of Eltham, spacious layout offering flexible dining. Premium of £475,000. + − | © OpenStreetMap contributors",3200,,SE9 1TS,['https://hummerstonehawkins.com/wp-content/uploads/2026/02/Ristorante-Italiano-183-185-High-Street-Eltham-SE9-1TS.pdf'],Hummerstone & Hawkins,,,,,,,Leasehold,To Let,2026-02-18,New
https://hummerstonehawkins.com/property/10451/,"Queens Street, Bexleyheath, DA7 4BT",15000,Office,"['https://hummerstonehawkins.com/wp-content/uploads/2025/09/Unit-1-Crown-House.jpg', 'https://hummerstonehawkins.com/wp-content/uploads/2025/09/1-Crown-House.jpg-2.jpg', 'https://hummerstonehawkins.com/wp-content/uploads/2025/09/1-Crown-House.jpg-1.jpg', 'https://hummerstonehawkins.com/wp-content/uploads/2025/09/1-Crown-House.jpg']","Well presented 1st floor office suite. Floor area of C. 1,571sq ft Property includes 2 parking spaces. Close to town & train station. Good transport links Available on a new 5 year lease. Property Summary *MODERN 1st FLOOR OFFICE SUITE TO LET* Floor area of C. 1,571sq ft. includes 2 parking spaces, well located for easy access to the town and train station. + − | © OpenStreetMap contributors",1570,,DA7 4BT,['https://hummerstonehawkins.com/wp-content/uploads/2025/11/Unit-1-Crown-House-Queen-Street-Bexleyheath-DA7-4BT.pdf'],Hummerstone & Hawkins,,,,,,,,For Sale,2026-02-18,New
