listingUrl,displayAddress,price,propertySubType,propertyImage,detailedDescription,sizeFt,sizeAc,postalCode,brochureUrl,agentCompanyName,agentName,agentCity,agentEmail,agentPhone,agentStreet,agentPostcode,tenure,saleType,date,status
https://www.kavanaghproperties.com/property/76-property-for-sale,"SWANFIELD ROAD, WALTHAM CROSS, HERTFORDSHIRE, EN8",194995,Flat,['https://cdn1.gnbproperty.com/gnb-user-uploads/cnb/images/kavanagh/notices/76/gallery/addd2fef59dcd80189975ac6bf9abc70.jpg'],"KAVANAGH PROPERTIES is thrilled to present this exquisite modern 1-bedroom apartment, complete with a stylish bathroom and the added convenience of a private parking space. To add to the flair of this apartment, it comes with a Juliet-style balcony. Nestled in the vibrant heart of Waltham Cross, this stunning residence is less than a 5-minute stroll away from the bustling Shopping Centre. You'll experience the perfect blend of comfort and accessibility in this enviable location! Imagine stepping outside your front door to discover a wealth of shopping, dining, and entertainment options at your fingertips. Plus, with close proximity to both bus and train stations, you're only moments away from seamless travel to London, Hertfordshire, and Essex. Whether you're commuting for work or exploring the sights, this apartment offers an unbeatable lifestyle. This property presents a versatile opportunity: Buy it to create your dream home, or invest in a lucrative rental opportunity. Whichever path you choose, you'll be making a wise decision in a location that promises growth and prosperity and the added bonus for this property is that it comes with a 990 year lease. Beyond its convenient amenities, Waltham Cross boasts a tranquil atmosphere that is perfect for families. Enjoy the serenity of suburban living while still being well-connected to the vibrant energy of London. This family-friendly environment ensures safety and community spirit, making it an ideal place to settle down. With easy access to major trunk roads including the A10, M25, and M11, this apartment is not just a home; it's a gateway to the best of both worlds. Specification as follows: All sizes in feet: Open living area: 18.7 X 9.4 bedroom: 10.7 X 9.1 bathroom: 7.7 X 3.3 lounge: 8.8 X 3.6 Don't miss out on this fantastic opportunity! Schedule a viewing today to experience the modern charm and prime location of this remarkable apartment. Your next chapter in Waltham Cross begins now—contact us at KAVANAGH PROPERTIES and see why this is the perfect match for you. Parking Availability: Yes",,,EN8,['https://cdn1.gnbproperty.com/gnb-user-uploads/cnb/images/kavanagh/notices/76/brochure/0808251108241109955043.pdf'],Kavanaghs,,,,,,,,For Sale,2026-02-18,Old
https://www.kavanaghproperties.com/property/84-lampits,"Hoddesdon, EN11",229000,Flat,"['https://cdn1.gnbproperty.com/gnb-user-uploads/cnb/images/kavanagh/notices/84/gallery/41ed922c8f3686e01047fd4a21194c57.jpg', 'https://cdn1.gnbproperty.com/gnb-user-uploads/cnb/images/kavanagh/notices/84/gallery/65ae32cdf5c63dfc0a5fcca8f5c8bc6f.jpg', 'https://cdn1.gnbproperty.com/gnb-user-uploads/cnb/images/kavanagh/notices/84/gallery/0f8132fe2c6c96b0751ea5182a369cfe.jpg', 'https://cdn1.gnbproperty.com/gnb-user-uploads/cnb/images/kavanagh/notices/84/gallery/24b1e84cafeef1448b6717c935282fde.jpg', 'https://cdn1.gnbproperty.com/gnb-user-uploads/cnb/images/kavanagh/notices/84/gallery/5826a29a2118693c2407ea880dbfc4e6.jpg', 'https://cdn1.gnbproperty.com/gnb-user-uploads/cnb/images/kavanagh/notices/84/gallery/afd0b4369094920d666ceec990e25021.jpg', 'https://cdn1.gnbproperty.com/gnb-user-uploads/cnb/images/kavanagh/notices/84/gallery/0b3277f5193d19ea5b0d311a74319226.jpg', 'https://cdn1.gnbproperty.com/gnb-user-uploads/cnb/images/kavanagh/notices/84/gallery/b735d03063de3cc89dddc8f3b4590ea6.jpg', 'https://cdn1.gnbproperty.com/gnb-user-uploads/cnb/images/kavanagh/notices/84/gallery/c7d75b38be6986ed63443f7853ae11cb.jpg', 'https://cdn1.gnbproperty.com/gnb-user-uploads/cnb/images/kavanagh/notices/84/gallery/60741655e0a96f1b7c14c2d4107d7788.jpg']",". An exceptionally spacious and immaculately presented 1 bedroom apartment situated in this sought after location on the edge of Hoddesdon Town Centre. The property provides bright and airy accommodation with full climate control and a spacious stunning bathroom with double base shower, making this, an ideal first time purchase or buy to let. The property comes with lots of internal storage, a long lease (original 999yrs) and is being offered as chain free. Communal entrance hallway; stairs to first floor landing; entrance door to; hallway; Walk in storage cupboard, telephone point, meter/storage cupboard, doors to; lounge; 19;6 x 9;7 double glazed window to front with views to lake, television and telephone point, doorway to; kitchen; 19; x 7.19; Range of wall and base units with complimentary tiling and work surfaces, sink unit, space for washing machine, cooker, fridge/freezer, double glazed window. Bedroom; 19; x 19;6 Built in wardrobe with sliding doors, double glazed window. Bathroom; 19;6 x 19;10 White Four piece suite comprising panel enclosed bath, pedestal hand wash basin, low level W.C, complimentary tiling and separate double base shower cubicle with electric shower. Exterior: Communal Gardens; Mainly laid to lawn. Parking: Casual parking spaces located within the immediate area.",,,EN11,[],Kavanaghs,,,,,,,,For Sale,2026-02-18,Old
https://www.kavanaghproperties.com/property/85-whitley-close,"Stanwell, TW19",229995,Flat,"['https://cdn1.gnbproperty.com/gnb-user-uploads/cnb/images/kavanagh/notices/85/gallery/7576ac428786e0e1d2ffd25af0bed854.jpg', 'https://cdn1.gnbproperty.com/gnb-user-uploads/cnb/images/kavanagh/notices/85/gallery/1382e84410deece5811095c225b2f26b.jpg', 'https://cdn1.gnbproperty.com/gnb-user-uploads/cnb/images/kavanagh/notices/85/gallery/cadfae0762121e0b20fd5a84f73c9b6b.jpg', 'https://cdn1.gnbproperty.com/gnb-user-uploads/cnb/images/kavanagh/notices/85/gallery/995beca6458e827724a324422d1fb688.jpg', 'https://cdn1.gnbproperty.com/gnb-user-uploads/cnb/images/kavanagh/notices/85/gallery/14247d7cd46ddde1e66fb7f985315240.jpg', 'https://cdn1.gnbproperty.com/gnb-user-uploads/cnb/images/kavanagh/notices/85/gallery/b30f5c6c21e0c7b0a34e031b3dbb4a1f.jpg', 'https://cdn1.gnbproperty.com/gnb-user-uploads/cnb/images/kavanagh/notices/85/gallery/06e9d6e23483f0cad974bf586da150b1.jpg', 'https://cdn1.gnbproperty.com/gnb-user-uploads/cnb/images/kavanagh/notices/85/gallery/767aad7f65a0071d2551bb0216a9d2f8.jpg']",". A very desirable 1 double bedroom 1st floor apartment with garage & benefitting from ample storage space. Specifications as follows: Total area space 69 square meters 3 piece white bathroom suite with shower, spacious lounge and large bedroom with fitted wardrobes. Situated a short walk from local shops and amenities. Communal first floor landing: Main Front door leading to flat. Private entrance hall: 8ft X 5.5ft Entrance hall area with Built in storage cupboards. Kitchen: 10.6ft x 5.7ft Fitted with a good range of wall and floor units, work surfaces, sink unit, plumbing and space for washing machine, cooker with oven, part tiled walls, sealed unit double glazed window. Lounge area: 10.9ft x 16.5ft Sealed unit double glazed window, radiator. Fitted carpet. Wall socket points. Glass framed door leading to kitchen. Bathroom: 5.7ft x 6.6ft Fully fitted 3 piece bathroom set which includes, WC, bath tub with shower facilities, sink and tiled walls. Bedroom: 9.6ft X 11.5ft Fitted carpet throughout. Double Glazed windows. Fixed fitted wardrobes. Socket power points. Single garage en-block Parking: Casual outside unallocated parking. Communal gardens surrounding the block. The property is offered on very long Leasehold Ground Rent: £10 per annum Service Charge: £105 pcm",,,TW19,[],Kavanaghs,,,,,,,Leasehold,For Sale,2026-02-18,Old
https://www.kavanaghproperties.com/property/83-26-ronmarsh,"Lambton Avenue, EN8",274995,Flat,"['https://cdn1.gnbproperty.com/gnb-user-uploads/cnb/images/kavanagh/notices/83/gallery/26112b3c94df05029b8e8d3e57ae9916.jpg', 'https://cdn1.gnbproperty.com/gnb-user-uploads/cnb/images/kavanagh/notices/83/gallery/1d4819f344164cc4b85529b39c264aab.jpg', 'https://cdn1.gnbproperty.com/gnb-user-uploads/cnb/images/kavanagh/notices/83/gallery/e98c00eab653604772cc0805560a0033.jpg', 'https://cdn1.gnbproperty.com/gnb-user-uploads/cnb/images/kavanagh/notices/83/gallery/c0dbbf33dc87c43a0720f8da7952d6fb.jpg', 'https://cdn1.gnbproperty.com/gnb-user-uploads/cnb/images/kavanagh/notices/83/gallery/b95a6c12f3966d434a0b7a61160965ec.jpg', 'https://cdn1.gnbproperty.com/gnb-user-uploads/cnb/images/kavanagh/notices/83/gallery/4bf6bb179abad566209342f0f4e0d649.jpg', 'https://cdn1.gnbproperty.com/gnb-user-uploads/cnb/images/kavanagh/notices/83/gallery/74a309ec6ec4e7e70117ca9562d9a4b9.jpg', 'https://cdn1.gnbproperty.com/gnb-user-uploads/cnb/images/kavanagh/notices/83/gallery/ec5e035067029857e4974cbe6f4709bb.jpg', 'https://cdn1.gnbproperty.com/gnb-user-uploads/cnb/images/kavanagh/notices/83/gallery/120bcfdb7f6ddfe4a86cd90a0ce6d361.jpg', 'https://cdn1.gnbproperty.com/gnb-user-uploads/cnb/images/kavanagh/notices/83/gallery/18f0005b93136fed1383b3f839623a4d.jpg', 'https://cdn1.gnbproperty.com/gnb-user-uploads/cnb/images/kavanagh/notices/83/gallery/4e926f57cccae4f71d0576e850bdf50d.jpg', 'https://cdn1.gnbproperty.com/gnb-user-uploads/cnb/images/kavanagh/notices/83/gallery/cc4e0e70c23592e2d153c50a1fc4f944.jpg']",". Offers are invited from buyers on this property. A very well presented 2 bedroom, 2 bathroom 1st floor purpose built apartment located just A stones throw away from waltham cross high street and within easy walking to br station serving liverpool st., stansted airport and cambridge. The property would be A great high yield rental return if for investment specification and property details as follows: Security entry pnone system: Via communal door to communal hall, door to:- main property entrance door : Door Front leading to:-. Hallway: Comprising of 2 storage cupboards, Leading to - lounge: 14'9' x 12'8' 4.50m x 3.86m Large open plan lounge with French doors leading Juliet Balcony, laminate flooring. Double glazed windows, 2 Gas central heating radiators, TV point, telephone point, lounge leading to kitchen. Open plan kitchen: 8'2' x 7'5' 2.50m x 2.25m Double glazed window, a range of fitted wall and base units, rolled top work surfaces single drainer sink unit with mixer taps, fitted cooker point, fitted fridge/freezer cupboard, plumbing for washing machine, built-in storage cupboard and vinyl flooring. En-suite master bedroom : 11'3 x 11'0' x 3.44m x 3.35m En-suite bathroom with shower cubicle, 3 piece bathroom set, laminate flooring throughout, Double glazed window, Gas central heating radiator, power socket points. Bedroom 2: 10'4' x 9'8' x 3.15m x 2.94m Double glazed, laminate flooring throughout, Gas central heating radiator, power socket points. Family bathroom: Double glazed window, Vinyl flooring, 3 piece bath suite comprising bath with mixer taps, low level WC, wash hand basin, Gas central heating radiator. Parking: Allocated Off-street parking. Tenure: Leasehold with 110 years remaining. Service charge: £1,400 per annum",,,EN8,[],Kavanaghs,,,,,,,Leasehold,For Sale,2026-02-18,Old
https://www.kavanaghproperties.com/property/81-vantage-buildings,"Vantage Building, UB3",,Flat,"['https://cdn1.gnbproperty.com/gnb-user-uploads/cnb/images/kavanagh/notices/81/gallery/aea2d71698249feefcf3f33a74e31598.jpg', 'https://cdn1.gnbproperty.com/gnb-user-uploads/cnb/images/kavanagh/notices/81/gallery/972036307b544dbacf119c3ab65c4cc2.jpg', 'https://cdn1.gnbproperty.com/gnb-user-uploads/cnb/images/kavanagh/notices/81/gallery/76cd801b17c7e8401ac1736a3a70e114.jpg', 'https://cdn1.gnbproperty.com/gnb-user-uploads/cnb/images/kavanagh/notices/81/gallery/99d54d39d5a7924b6174909b00957b71.jpg', 'https://cdn1.gnbproperty.com/gnb-user-uploads/cnb/images/kavanagh/notices/81/gallery/c338b390dd492c4efc5f186ec7f49cff.jpg', 'https://cdn1.gnbproperty.com/gnb-user-uploads/cnb/images/kavanagh/notices/81/gallery/0bd8b3eb604b6ae2448a37e7cbdc7f9d.jpg', 'https://cdn1.gnbproperty.com/gnb-user-uploads/cnb/images/kavanagh/notices/81/gallery/d578aa54d9bf8c3b928fa4431cb41b48.jpg', 'https://cdn1.gnbproperty.com/gnb-user-uploads/cnb/images/kavanagh/notices/81/gallery/c691b854816dff0196198cd55def588b.jpg', 'https://cdn1.gnbproperty.com/gnb-user-uploads/cnb/images/kavanagh/notices/81/gallery/f2ae3f672f044f1ff427b789bc19ec6b.jpg', 'https://cdn1.gnbproperty.com/gnb-user-uploads/cnb/images/kavanagh/notices/81/gallery/3f21dd85a460f9f0dfeccb6f80bf17cd.jpg', 'https://cdn1.gnbproperty.com/gnb-user-uploads/cnb/images/kavanagh/notices/81/gallery/50ad301a3b6aeff4292b28d3803855ab.jpg', 'https://cdn1.gnbproperty.com/gnb-user-uploads/cnb/images/kavanagh/notices/81/gallery/d37f6288b05694de337e89d5bc7523c1.jpg', 'https://cdn1.gnbproperty.com/gnb-user-uploads/cnb/images/kavanagh/notices/81/gallery/e111df77e2973bbf759a994c01e363e1.jpg']","Stunning building complex Balcony with stunning canal views Private secure parking Fitted wardrobes Entry phone system Fully furnished Deposit amount : £1,955.76",,,UB3,[],Kavanaghs,,,,,,,,,2026-02-18,Old
https://www.kavanaghproperties.com/property/97-property-for-rent,"Riverside Mews, Pembroke Close, EN10",,Maisonette,"['https://cdn1.gnbproperty.com/gnb-user-uploads/cnb/images/kavanagh/notices/97/gallery/015d8b57d3edd68e84288410bb17e9ff.jpg', 'https://cdn1.gnbproperty.com/gnb-user-uploads/cnb/images/kavanagh/notices/97/gallery/6d9cd456757ce0df9e7f5cf0be86da7f.jpg', 'https://cdn1.gnbproperty.com/gnb-user-uploads/cnb/images/kavanagh/notices/97/gallery/30fa62c4dbe629f94d0765c5481f8642.jpg', 'https://cdn1.gnbproperty.com/gnb-user-uploads/cnb/images/kavanagh/notices/97/gallery/d007eaef8e8d01402890464953c73973.jpg', 'https://cdn1.gnbproperty.com/gnb-user-uploads/cnb/images/kavanagh/notices/97/gallery/ac74187a139e3802c1e91dc4cf8b1b7e.jpg', 'https://cdn1.gnbproperty.com/gnb-user-uploads/cnb/images/kavanagh/notices/97/gallery/c79e07ec83d2457b6744a59708883a74.jpg', 'https://cdn1.gnbproperty.com/gnb-user-uploads/cnb/images/kavanagh/notices/97/gallery/6e37a59df7d79dd0e58524e19c80aebc.jpg', 'https://cdn1.gnbproperty.com/gnb-user-uploads/cnb/images/kavanagh/notices/97/gallery/de1a853e7ad091342e36eefcd8809589.jpg', 'https://cdn1.gnbproperty.com/gnb-user-uploads/cnb/images/kavanagh/notices/97/gallery/24100a15a096df8bf315e6a78e4c8313.jpg', 'https://cdn1.gnbproperty.com/gnb-user-uploads/cnb/images/kavanagh/notices/97/gallery/8d219414b94754e2064ffc1c292fde5a.jpg', 'https://cdn1.gnbproperty.com/gnb-user-uploads/cnb/images/kavanagh/notices/97/gallery/133a9c5665da0f96555ebb8826fd92b0.jpg', 'https://cdn1.gnbproperty.com/gnb-user-uploads/cnb/images/kavanagh/notices/97/gallery/d3a1314fd7a950be28f95ddff9b346b2.jpg', 'https://cdn1.gnbproperty.com/gnb-user-uploads/cnb/images/kavanagh/notices/97/gallery/51a23c0ee56d72cdf8b89efa4a25ade8.jpg', 'https://cdn1.gnbproperty.com/gnb-user-uploads/cnb/images/kavanagh/notices/97/gallery/485d0323fcc1a0436854f9cd12f59fcc.jpg', 'https://cdn1.gnbproperty.com/gnb-user-uploads/cnb/images/kavanagh/notices/97/gallery/54d10d774df1ce448a92be43cacbc962.jpg', 'https://cdn1.gnbproperty.com/gnb-user-uploads/cnb/images/kavanagh/notices/97/gallery/e45d3d0045be0d5f08d605e693ee1c03.jpg', 'https://cdn1.gnbproperty.com/gnb-user-uploads/cnb/images/kavanagh/notices/97/gallery/8b877d73edd91747466c93f74308d9c4.jpg', 'https://cdn1.gnbproperty.com/gnb-user-uploads/cnb/images/kavanagh/notices/97/gallery/5e855d735d9ac31973962c08accc5c1f.jpg']","KAVANAGH PROPERTIES are delighted to present this stunning, newly decorated 2 bedroom, 2 WC's and garage, maisonette located at River Side Mews in Broxbourne, Hertfordshire, this 2-bedroom maisonette at River Side Mews s locatedd in this this most desirable culdesac setting and beautiful River views. The property has been recently renovated to high standards which includeds a new kitchen. Newly fitted carpets throughout. Onsite garage. Off-road parking, ensuring convenience for residents. The maisonette features a well-designed layout, including a functional kitchen and living area. The bedrooms offer ample space, making it suitable for various living arrangements. The property is situated in a residential area with access to local amenities. Broxbourne offers a range of shops, dining options, and recreational facilities. The nearby transport links provide easy access to surrounding areas, making it a convenient location for commuting. Energy Performance Certificate (EPC) details are available upon request. Council Tax Band : D Deposit amount : £2,071.14 Parking Availability: Yes",,,EN10,[],Kavanaghs,,,,,,,,,2026-02-18,Old
https://www.kavanaghproperties.com/property/89-dison-close,"Enfield, EN3",,End Terrace,"['https://cdn1.gnbproperty.com/gnb-user-uploads/cnb/images/kavanagh/notices/89/gallery/c69f0ca8ccf073987fd88e9366457b7f.jpg', 'https://cdn1.gnbproperty.com/gnb-user-uploads/cnb/images/kavanagh/notices/89/gallery/e52f893b7156b1fe9f4ee0513d5ca90f.jpg', 'https://cdn1.gnbproperty.com/gnb-user-uploads/cnb/images/kavanagh/notices/89/gallery/20b80580ced659524f114398eb69e96d.jpg', 'https://cdn1.gnbproperty.com/gnb-user-uploads/cnb/images/kavanagh/notices/89/gallery/1382d8f62c6ee18956502e0f5377550e.jpg', 'https://cdn1.gnbproperty.com/gnb-user-uploads/cnb/images/kavanagh/notices/89/gallery/844c35208cac1157ed25fa1787be08b9.jpg', 'https://cdn1.gnbproperty.com/gnb-user-uploads/cnb/images/kavanagh/notices/89/gallery/62bfa1fb812e47cc90f1f6dc8a5c2f2d.jpg', 'https://cdn1.gnbproperty.com/gnb-user-uploads/cnb/images/kavanagh/notices/89/gallery/859198f177b2f0f39b0f09858e321d04.jpg', 'https://cdn1.gnbproperty.com/gnb-user-uploads/cnb/images/kavanagh/notices/89/gallery/34c1168049fa629116b099d5195700a0.jpg', 'https://cdn1.gnbproperty.com/gnb-user-uploads/cnb/images/kavanagh/notices/89/gallery/30cd8b268503a58a94df8c677a6d0d9f.jpg', 'https://cdn1.gnbproperty.com/gnb-user-uploads/cnb/images/kavanagh/notices/89/gallery/e3e0ed2be252702af5f06e2786df65ea.jpg']","Located in Enfield, this 3-bedroom end terrace property offers a practical living space with one bathroom and one reception room. The property is part-furnished, providing flexibility for tenants. Key features include off-road parking and a large garden, ideal for outdoor activities. The property benefits from gas central heating with a combi boiler, ensuring efficient heating throughout the home. Inside, the property boasts double bedrooms, providing ample space for residents. The kitchen is equipped with essential appliances and offers access to the garden, enhancing the indoor-outdoor flow. The reception room is well-sized, providing a comfortable area for relaxation and entertainment. The bathroom is fitted with modern fixtures, including a bathtub and a shower. The property’s layout is designed for convenience, with easy access to all rooms. The large garden offers a private outdoor space, perfect for enjoying the outdoors. Enfield is a well-connected area with various amenities, including shops, schools, and public transport options. The property’s location provides easy access to local services and facilities, making it a convenient choice for residents. The energy performance certificate (EPC) details are available upon request, ensuring transparency regarding the property’s energy efficiency. Overall, this end terrace property in Enfield offers a practical and comfortable living space with essential features and amenities. Deposit amount : £3,109.60",,,EN3,[],Kavanaghs,,,,,,,,,2026-02-18,Old
