listingUrl,displayAddress,price,propertySubType,propertyImage,detailedDescription,sizeFt,sizeAc,postalCode,brochureUrl,agentCompanyName,agentName,agentCity,agentEmail,agentPhone,agentStreet,agentPostcode,tenure,saleType,date,status
https://www.nmrk.com/en-gb/properties/5-10-brandon-road-london-lease,"5-10 Brandon Road, London, England  N7 9AA",,Laboratory / Office,"['https://s3.amazonaws.com/buildout-production/datas/34695206/e65d259fc238e05691eed33acf3fbbc63d61cd0e/full.jpg?1772728877', 'https://d33y5rc9xva21v.cloudfront.net/eyJidWNrZXQiOiJidWlsZG91dC1wcm9kdWN0aW9uIiwia2V5IjoiZGF0YXMvMzQ2OTUyMDYvZTY1ZDI1OWZjMjM4ZTA1NjkxZWVkMzNhY2YzZmJiYzYzZDYxY2QwZS9vcmlnaW5hbC5qcGciLCJlZGl0cyI6eyJyZXNpemUiOnsid2lkdGgiOjUwMCwiaGVpZ2h0Ijo1MDAsImZpdCI6Imluc2lkZSIsIndpdGhvdXRFbmxhcmdlbWVudCI6dHJ1ZX0sInJvdGF0ZSI6bnVsbH0sInVwZGF0ZWRBdCI6MTc3MjcyODg3N30=']","MAYDE, 5-10 Brandon Road offers 113,000 sq. ft of combined GMP manufacturing, laboratory and office space in the heart of London's innovation district. With a variety of size, specification and level of fit out available, the state-of-the-art building provides established, early stage and growing companies the space to innovate and operate. As a tenant of the building, you will have access to a wide range of amenities both within the site and its immediate vicinity, including communal areas, end of journey facilities and an onsite cafe; as well as Kadans' team of experts who bring their extensive knowledge to the design and delivery of new space.  Location: Kings Cross contains a vibrant mix of buildings and public spaces, playing host to many major technology and research centres such as Google, Facebook, AstraZeneca and The Francis Crick Institute. Excellent transport links across London, the UK and the rest of Europe mark Kings Cross as a standout location for organisations seeking to create a London hub, with life science at the front of this movement. MAYDE is the first of four buildings being developed within the Tileyard Quarter, which will deliver in total 350,000 sq. ft of GMP manufacturing and laboratory accommodation. We are excited the building has now completed, offering the opportunity to acquire space in this growing hub within London's science and creative district.  Highlights: Within the King's Cross science and tech cluster Immediate options to take either a fully fitted option, or lab enabled Cat A space Flexible layout, enabling highly technical laboratory and pilot plant equipment Communal areas, breakout spaces and onsite cafe Generous dimensions with a 7.4m slab-to-slab on ground floor and 3.8 - 4.1 on upper floors Significant power and M&E capabilities BREEAM Excellent and Wiredscore GOLD",1469,,N7 9AA,,Newmark,Paddy Shipp,,paddy.shipp@nmrk.com,+44 20 3486 3725,,,Leasehold,To Let,2026-03-09,New
https://www.nmrk.com/en-gb/properties/4-brandon-road-london-lease,"4 Brandon Road , London, England  N7 9AA",,Laboratory / Office,"['https://s3.amazonaws.com/buildout-production/datas/34695438/617b07b058128ec4a39594cce85e581ff1ed1744/full.jpg?1772729619', 'https://d33y5rc9xva21v.cloudfront.net/eyJidWNrZXQiOiJidWlsZG91dC1wcm9kdWN0aW9uIiwia2V5IjoiZGF0YXMvMzQ2OTU0MzgvNjE3YjA3YjA1ODEyOGVjNGEzOTU5NGNjZTg1ZTU4MWZmMWVkMTc0NC9vcmlnaW5hbC5qcGciLCJlZGl0cyI6eyJyZXNpemUiOnsid2lkdGgiOjUwMCwiaGVpZ2h0Ijo1MDAsImZpdCI6Imluc2lkZSIsIndpdGhvdXRFbmxhcmdlbWVudCI6dHJ1ZX0sInJvdGF0ZSI6bnVsbH0sInVwZGF0ZWRBdCI6MTc3MjcyOTYxOX0=']","Versa, located at 4 Brandon Road, is the second of four buildings within Kadans' new science and innovation district called Tileyard Quarter. Versa combines high-quality R&D laboratories with offices spaces in a modern design. The flexible layout of the building enables you to shape your space, allowing you to grow while focusing on innovation. The building offers 51,600 sq ft of advanced technical infrastructure, which can accommodate up to 60% laboratory space. Features include a minimum of 6 air changes per hour, minimum 1.2mVA power to the site, onsite loading bay and dedicated tenant risers / plant designation. The building is built with future-proof design and, given its size, is perfect for multiple innovative life sciences companies as well as a single client headquarter building.  Location: Kings Cross contains a vibrant mix of buildings and public spaces, playing host to many major technology and research centres such as Google, Facebook, AstraZeneca and The Francis Crick Institute. Excellent transport links across London, the UK and the rest of Europe mark Kings Cross as a standout location for organisations seeking to create a London hub, with life science at the front of this movement. MAYDE is the first of four buildings being developed within the Tileyard Quarter, which will deliver in total 350,000 sq. ft of GMP manufacturing and laboratory accommodation. We are excited the building has now completed, offering the opportunity to acquire space in this growing hub within London's science and creative district.  Highlights: Completion Q2 2026 High quality CL2 laboratory and office spaces Within the King's Cross Life Sciences cluster Support with fit out Targeting BREEAM Excellent and WiredScore / SmartScore accreditation Flexible layout, with communal areas and breakout rooms",51600,,N7 9AA,,Newmark,Paddy Shipp,,paddy.shipp@nmrk.com,+44 20 3486 3725,,,Leasehold,To Let,2026-03-09,New
https://www.nmrk.com/en-gb/properties/22-station-road-cambridge-lease,"22 Station Road, Cambridge, England  CB1 2JD",,Office Building,"['https://s3.amazonaws.com/buildout-production/datas/34693089/b681fab704adf42c05862e0894448336d5176410/full.jpg?1772718400', 'https://d33y5rc9xva21v.cloudfront.net/eyJidWNrZXQiOiJidWlsZG91dC1wcm9kdWN0aW9uIiwia2V5IjoiZGF0YXMvMzQ2OTMwODkvYjY4MWZhYjcwNGFkZjQyYzA1ODYyZTA4OTQ0NDgzMzZkNTE3NjQxMC9vcmlnaW5hbC5qcGciLCJlZGl0cyI6eyJyZXNpemUiOnsid2lkdGgiOjUwMCwiaGVpZ2h0Ijo1MDAsImZpdCI6Imluc2lkZSIsIndpdGhvdXRFbmxhcmdlbWVudCI6dHJ1ZX0sInJvdGF0ZSI6bnVsbH0sInVwZGF0ZWRBdCI6MTc3MjcxODQwMH0=']","22 Station Road is a 64,800 sq. ft office building, providing Grade A space over six floors and excellent views over Cambridge city centre. With a ground floor concierge reception, end of journey facilities and secure parking at basement level, the building provides a good variety of amenity. In addition, the building incorporates a green roof and roof terrace. The available 3rd and 4th floor suites comprise 5,676 and 5,792 sq. ft respectively, both benefitting from a good quality fit out, with fully accessible raised floors and suspended ceilings throughout (furniture is not included). Each suites benefits from 3 parking spaces within the secure basement car park.  Location: Located at the centre of Cambridge's CB1 development on prime pitch, Station Road has attracted an impressive array of occupiers including Amazon, Apple, Microsoft, WeWork and Deloitte. The building itself is located within easy walking distance of Cambridge city centre, and just 2 minute's walk (250 metres) from Cambridge station, providing access to London Kings Cross (48 minutes) and Liverpool Street (1h 15 minutes).  Highlights: Centrally located in Cambridge's CB1 development Neighbouring occupiers include Amazon, Apple, Microsoft, WeWork and Deloitte Fully accessible office space with raised floors and suspended ceilings throughout Good quality fit out (furniture not included) Undercroft parking provides 3 spaces per suite WCs on each floor, with showers in the basement Undercover bike storage",5676,,CB1 2JD,,Newmark,Rupert Dando,,rupert.dando@nmrk.com,+44 7813 624276,,,Leasehold,To Let,2026-03-09,New
https://www.nmrk.com/en-gb/properties/477-malton-avenue-slough-lease-1593072,"477 Malton Avenue, Slough, England  SL1 4QU",,Manufacturing,"['https://s3.amazonaws.com/buildout-production/datas/34131223/2601604aaf4646f1b2482626a4c4bb588963bbe4/full.png?1767692545', 'https://d33y5rc9xva21v.cloudfront.net/eyJidWNrZXQiOiJidWlsZG91dC1wcm9kdWN0aW9uIiwia2V5IjoiZGF0YXMvMzQxMzEyMjMvMjYwMTYwNGFhZjQ2NDZmMWIyNDgyNjI2YTRjNGJiNTg4OTYzYmJlNC9vcmlnaW5hbC5wbmciLCJlZGl0cyI6eyJyZXNpemUiOnsid2lkdGgiOjUwMCwiaGVpZ2h0Ijo1MDAsImZpdCI6Imluc2lkZSIsIndpdGhvdXRFbmxhcmdlbWVudCI6dHJ1ZX0sInJvdGF0ZSI6bnVsbH0sInVwZGF0ZWRBdCI6MTc2NzY5MjU0NX0=']","A single storey warehouse/industrial unit available to let situated on the established Slough Trading Estate. 477 Malton Avenue benefits from multiple access routes from Buckingham Avenue, which is the main throughfare through Slough Trading Estate.",6468,,SL1 4QU,https://buildout.com/docs/documents/4037659?token=3380a901de410be9fabf88582b4da60898c00a39,Newmark,Chloe Sweetland,,chloe.sweetland@nmrk.com,+44 7385 933686,,,Leasehold,To Let,2026-03-09,New
https://www.nmrk.com/en-gb/properties/50-whitby-road-slough-lease,"50 Whitby Road, Slough, England  SL1 3DW",,Warehouse/Distribution,"['//assets.buildout.com/assets/plugins/photo_placeholder-623024d78d77741a2e8b3318edee992ccd44bf2abfffe503a77470578eff2a60.png', '//assets.buildout.com/assets/plugins/photo_placeholder-623024d78d77741a2e8b3318edee992ccd44bf2abfffe503a77470578eff2a60.png']",A prominent warehouse / office unit available to let situated on the established Slough Trading Estate. Additional information to be added.,2110,,SL1 3DW,,Newmark,Chloe Sweetland,,chloe.sweetland@nmrk.com,+44 7385 933686,,,Leasehold,To Let,2026-03-09,New
https://www.nmrk.com/en-gb/properties/54-postal-83-whitby-road-slough-lease,"54 (Postal 83) Whitby Road, Slough  SL1 3DR",,Warehouse/Distribution,"['https://s3.amazonaws.com/buildout-production/datas/34123501/4ec480d13298786e4d30908da388b30c17a9af5a/full.png?1767632263', 'https://d33y5rc9xva21v.cloudfront.net/eyJidWNrZXQiOiJidWlsZG91dC1wcm9kdWN0aW9uIiwia2V5IjoiZGF0YXMvMzQxMjM1MDEvNGVjNDgwZDEzMjk4Nzg2ZTRkMzA5MDhkYTM4OGIzMGMxN2E5YWY1YS9vcmlnaW5hbC5wbmciLCJlZGl0cyI6eyJyZXNpemUiOnsid2lkdGgiOjUwMCwiaGVpZ2h0Ijo1MDAsImZpdCI6Imluc2lkZSIsIndpdGhvdXRFbmxhcmdlbWVudCI6dHJ1ZX0sInJvdGF0ZSI6bnVsbH0sInVwZGF0ZWRBdCI6MTc2NzYzMjI2M30=']","A single-storey Industrial/warehouse building space situated on the established Slough Trading Estate. This unit is available to let. Features: - 3.96 m eaves height at front - 3.13m eaves height at rear - Up-and-over loading door, front access - 2 WCs – 1 Male, 1 Female - 4 allocated car parking spaces(subject to re-allocation) - 3-Phase electricity - EPC available on request 54 (Postal 83) Whitby Road benefits from multiple access routes from Buckingham Avenue, which is the main throughfare through Slough Trading Estate. Slough Trading Estate offers direct access to the A355 Farnham Road, which in turn leads directly to junction 6 of the M4 to the south and Junction 2 of the M40 to the north.",1468,,SL1 3DR,https://buildout.com/docs/documents/4036488?token=618df52a42cb84742815647d0613e488f804fd09,Newmark,Chloe Sweetland,,chloe.sweetland@nmrk.com,+44 7385 933686,,,Leasehold,To Let,2026-03-09,New
